{
  "session": "53d7703c-613e-4c00-b9ab-a400db09b847",
  "cwd": "/Users/user/dev/subspace/tools/hook-capture/claude-code",
  "state": "working",
  "claude_code_session": {
    "status": "busy",
    "status_at": 1790968985602,
    "pid": 3668,
    "process_kind": "interactive",
    "entrypoint": "cli",
    "name": "claude-code-0a",
    "version": "2.1.287",
    "started_at": 1790968981781,
    "updated_at": 1790968985602
  }
}
