{
  "session": "c0d8cfbd-d33c-4f40-8638-aee29917c901",
  "cwd": "/Users/user/dev/subspace/tools/hook-capture/claude-code",
  "state": "idle",
  "claude_code_session": {
    "status": "idle",
    "status_at": 1790969258431,
    "pid": 7793,
    "process_kind": "interactive",
    "entrypoint": "sdk-cli",
    "name": "claude-code-95",
    "version": "2.1.287",
    "started_at": 1790969254224,
    "updated_at": 1790969258431
  }
}
