{
  "session": "12ce6954-14e0-488c-9478-5e0f9754d416",
  "cwd": "/Users/user/dev/subspace/tools/hook-capture/claude-code",
  "state": "working",
  "claude_code_session": {
    "status": "busy",
    "status_at": 1793486540018,
    "pid": 6280,
    "process_kind": "interactive",
    "entrypoint": "cli",
    "name": "claude-code-95",
    "version": "2.1.316",
    "started_at": 1793486504845,
    "updated_at": 1793486540018
  }
}
