{
  "session": "b57f0fcd-6655-4fac-b576-4e6053746794",
  "cwd": "/Users/user/dev/subspace/tools/hook-capture/claude-code",
  "state": "working",
  "claude_code_session": {
    "status": "busy",
    "status_at": 1793550701971,
    "pid": 8529,
    "process_kind": "interactive",
    "entrypoint": "cli",
    "name": "claude-code-ce",
    "version": "2.1.316",
    "started_at": 1793550698257,
    "updated_at": 1793550701971
  }
}
